{
  "schema": "aoa_local_memo_candidate_v1",
  "id": "candidate:example-repo:20260520T171200Z:codex-plane-memory-route",
  "repo": "example-repo",
  "kind": "route",
  "family": "memory-access",
  "scope": "repo",
  "claim": "aoa_memo should be used for memory briefs and candidate creation when continuity or reviewed memory intake is needed.",
  "source_refs": [
    "docs/memory/LOCAL_MEMO_PORT_STANDARD.md",
    "docs/memory/MEMO_PORT_INDEXING_VOCABULARY.md"
  ],
  "evidence_refs": [
    "examples/memory-ports/example-port/PORT.yaml"
  ],
  "route": "reviewed_intake",
  "review_state": "candidate",
  "lifecycle": "captured",
  "source_trust": "review_required",
  "operation_mode": "write_candidate_only",
  "created_at": "2026-05-20T17:12:00Z",
  "risk": [
    "stale_context"
  ],
  "guardrails": {
    "direct_durable_write": false,
    "instructions_treated_as_data": true,
    "requires_reviewed_intake": true
  }
}

